{
  "candidate_run_id": "tunsil-absence-shock-v0",
  "claimed_available_at": "2026-08-13T14:10:32Z",
  "content_digest": "sha256:bb92e42c4dfb15b6766eaf567509f0e10d70763a27e70e305a88db123adc539c",
  "cutoff_at": "2026-08-13T14:13:09Z",
  "evidence_ref": {
    "artifact_type": "source_metadata",
    "digest": "sha256:ab139bfde005719af6232bf5c6156c2c1b8236f80d7b90e63b431542998c193b",
    "digest_mode": "tiber-canonical-json-v1",
    "path": "runs/tunsil-absence-shock-v0/sources/src-commanders-white-five-things/metadata.json"
  },
  "metadata_digest": "sha256:ab139bfde005719af6232bf5c6156c2c1b8236f80d7b90e63b431542998c193b",
  "observation_method": "operator_provided_packet",
  "observed_at": "2026-08-13T18:53:09Z",
  "observer": {
    "observer_id": "Joseph (@Prometheus-Frameworks)",
    "role": "operator",
    "trust_basis": "Per-instance Manual Witness admission authority recorded in TIBER-Research issue #3 comment 5281497231 §1; retrieval performed once per page by the authorized Claude preflight lane under operator direction with true clocks recorded."
  },
  "receipt_id": "avail-src-commanders-white-five-things",
  "revision_id": "sha256:7072db37c06281522214478a53623253f435d988e14be00751570c1e53a4d06d",
  "schema_version": "research-external-source-availability-receipt/v1",
  "source_family_id": "commanders-official-club-site",
  "source_identifier": "https://www.commanders.com/news/five-things-to-know-rachaad-white",
  "source_object_id": "src-commanders-white-five-things",
  "trust_boundary": {
    "boundary_id": "issue-3-manual-witness-admission",
    "boundary_type": "operator_attestation",
    "policy_ref": {
      "artifact_type": "observation_policy",
      "digest": "sha256:ceabc76f6e81aad44ac79861fb49741402c1931426f76c106589b336f068d009",
      "digest_mode": "tiber-canonical-json-v1",
      "path": "preflight/tunsil-absence-shock-v0/controls/observation-policy.json"
    }
  }
}
