{
  "candidate_run_id": "tunsil-absence-shock-v0",
  "claimed_available_at": "2026-08-13T14:10:25Z",
  "content_digest": "sha256:1121207aabdcc317101131334de294146259a67da5099ef391b07991fe434875",
  "cutoff_at": "2026-08-13T15:00:00Z",
  "evidence_ref": {
    "artifact_type": "source_metadata",
    "digest": "sha256:1116a7a03675af5ef72ec83088f419a3fcbb6e033a2b71984c610eec5833c919",
    "digest_mode": "tiber-canonical-json-v1",
    "path": "preflight/tunsil-absence-shock-v0/sources/src-commanders-2025-oline-review/metadata.json"
  },
  "metadata_digest": "sha256:1116a7a03675af5ef72ec83088f419a3fcbb6e033a2b71984c610eec5833c919",
  "observation_method": "operator_provided_packet",
  "observed_at": "2026-08-13T14:30:05Z",
  "observer": {
    "observer_id": "Joseph (@Prometheus-Frameworks)",
    "role": "operator",
    "trust_basis": "Per-instance Manual Witness admission authority recorded in TIBER-Research issue #3 comment 5281497231 §1; retrieval performed once per page by the authorized Claude preflight lane under operator direction with true clocks recorded."
  },
  "receipt_id": "avail-src-commanders-2025-oline-review",
  "revision_id": "sha256:1121207aabdcc317101131334de294146259a67da5099ef391b07991fe434875",
  "schema_version": "research-external-source-availability-receipt/v1",
  "source_family_id": "commanders-official-club-site",
  "source_identifier": "https://www.commanders.com/news/commanders-2025-position-review-offensive-line",
  "source_object_id": "src-commanders-2025-oline-review",
  "trust_boundary": {
    "boundary_id": "issue-3-manual-witness-admission",
    "boundary_type": "operator_attestation",
    "policy_ref": {
      "artifact_type": "observation_policy",
      "digest": "sha256:05bfb7fa39268088e2c3354102453b1afa2ff53f00e1a10f000d12ec8ac13c50",
      "digest_mode": "tiber-canonical-json-v1",
      "path": "preflight/tunsil-absence-shock-v0/controls/observation-policy.json"
    }
  }
}
