{
  "candidate_run_id": "tunsil-absence-shock-v0",
  "claimed_available_at": "2026-08-13T14:10:40Z",
  "content_digest": "sha256:9afacd6c3e36fb9a9b4db441f6285d2e4356fbb97e72338ac5e9b72194370421",
  "cutoff_at": "2026-08-13T14:13:09Z",
  "evidence_ref": {
    "artifact_type": "source_metadata",
    "digest": "sha256:9941572e8d0f3e9bab85cf475471d2f325ac17393be06fdb831db068d96d3108",
    "digest_mode": "tiber-canonical-json-v1",
    "path": "runs/tunsil-absence-shock-v0/sources/src-commanders-joint-practice-dolphins/metadata.json"
  },
  "metadata_digest": "sha256:9941572e8d0f3e9bab85cf475471d2f325ac17393be06fdb831db068d96d3108",
  "observation_method": "operator_provided_packet",
  "observed_at": "2026-08-13T18:53:09Z",
  "observer": {
    "observer_id": "Joseph (@Prometheus-Frameworks)",
    "role": "operator",
    "trust_basis": "Per-instance Manual Witness admission authority recorded in TIBER-Research issue #3 comment 5281497231 §1; retrieval performed once per page by the authorized Claude preflight lane under operator direction with true clocks recorded."
  },
  "receipt_id": "avail-src-commanders-joint-practice-dolphins",
  "revision_id": "sha256:c04ee6083a7ff14f5151caa2445de1e52a8c32467ab05e8ef049b2c4ee66a54c",
  "schema_version": "research-external-source-availability-receipt/v1",
  "source_family_id": "commanders-official-club-site",
  "source_identifier": "https://www.commanders.com/news/commanders-dolphins-training-camp-practice-notes",
  "source_object_id": "src-commanders-joint-practice-dolphins",
  "trust_boundary": {
    "boundary_id": "issue-3-manual-witness-admission",
    "boundary_type": "operator_attestation",
    "policy_ref": {
      "artifact_type": "observation_policy",
      "digest": "sha256:1eb11037ed4ecbbffae5576d55c1c9c6a337d1c9f3defd580d49f63bc58f42df",
      "digest_mode": "tiber-canonical-json-v1",
      "path": "preflight/tunsil-absence-shock-v0/controls/observation-policy.json"
    }
  }
}
